tl,en
dana white bob arum fixed bradley fight stall vs,
superstar waiting,
goodluck,
tingin idol mamayagpag halalan karapatdapat manalo,
like share follow legal education,
want president coming election,
im build back better leni robredo great reset puppet candidate will bring doorstep wake filipinos,
thats right mayweather gt pacquiao,
whats pacquiao collection legacy amp gods warrior tees available,
boxing icon presidential candidate manny says will welcome international probe president rodrigo dutertes war drugs elected promised fight narcotics right way due process street shootings,
happy presidents day cardinal hayes high school,
weeks contains proof quiver full spend day family enjoy holiday,
pray country pray leaders pray chaplain corps continue deliver likekind ministries chaplain washington valley forge,
welcome bring miss join us,
notso christian karen,
will use voice means life fighting future grandchildren intact freedom,
im brave enough stand believed right,
accept cryptocurrency donate today,
love christian leader will go,
daming lumabas survey election nainterview,
mag kaisa sambayanang pilipino edsa kontra kahirapan edsa kontra nakaupo malacanang mauupo malacanang,
kelangan hilahin sinoman nakaupo instead supportahan mong di makapagpabigat bayad kalabanin tao,
leading kakampink leni impossible ung marcos sure possibleng kakampink masalimuot dinanas marcos,
ph demographics last ages experience young remember marcos regime ages firsthand experience marcos regime,
manny can speak fluently thoughts still thank sir genuine heart boxing govt service always carry flag country,
wala nice nakamask memes photo hahahaha char manny,
botante malinaw makakapagdecision iboboto bukas mata nagpabudol magnanakawsinungalingwalang diplomalaki nakaw,
filipino community koanny pacman ahahaha,
pinupuri lgbtq community samesex union maibigay iboboto homophobic ever since,
yes fired throwing punches best candidate can count lead country prayer diyos bayan,
manny please dont expect win hahhaha,
imagine todo debate facebook twitter kandidato wala debate,
gets rolling will interesting quality top notch big names wonder will next just building like project,
vp sen sen said lot good points,
abolish prisons establish gulags,
jusko magwithdraw kanna inendorse,
case people failed see evil partners abusive partners basically hid part abused system keep victims grasp,
ok religious remember theres separation state church puro faithbased,
love sinner hate sin,
hala ayan nananamn,
part todays speaks time history choose leader will confidently entrust life future including children,
buy amp read today feb sunday newspaper column senator part presidential candidates series,
maraming salamat marikina city ipaglalaban,
makabuluhang araw lunes senator koko pimentel senator manny pacquiao campaign leaders team manny pacquiao president,
nakakainis ibang kakampinks edukado kuno ayaw mag asal edukado please guys respect others choices,
legend continues manny pacquiao son won first amateur fight watch full fight,
thanks keiffer boxing ring founder manny pacquiao strives bring honor philippines cant without make difference giving today,
nag kakandidato rally inaatupag kundi issue ekonomiya dat palang galaw gagalaw naka upo tangina kawawa mahihirap,
mas magiging makabuluhan aatras susuporta,
manny pacquiao congratulates jimuel winning st amateur fight us read,
crees que logre llevar nuevamente el apellido lo estelares del boxeo,
long day traininga real champion beautiful wife,
aminin kayang tapatan ganitong energy saya grand rally,
ayaw niyu idol free,
first thing want candidates asked can vouch integrity everyone senatorial slate,
manny pacquiaos son emmanuel amateur fight today san diego house boxing gym paradise hills,
every time workout remember clip motivates want push want push original video,
celebrities endorsing political candidates can help us understand sharing reasons vote just performing stage using generic taglines,
thank inspiration honoring roots philip need want give back like philip please visit,
seem understand war much value average american decent match probably brings money entire economy year less hours,
itong eleksiyon daming entitled bukod cancel cancel culture end entitlement attitude rainbow color samasama,
memorable fight think match,
nangnaaway besh please respect supporters supporters presidential candidates fact wag kayong ganyan teh cant convince people support want support way sobrang,
wwe manny pacquiao create superstar boxer amp senate attire psn ryderozpin create superstar releases follow soon,
regular,
fight together ready lets empower communities philippines visit,
floyd mayweather king pacquiao tyson alltime ppv sales,
manny pacquiao hot debate opens following errol spence jr comments,
send money philippines zero fees download now enjoy free credit code mpf,
pinklawan niyo icheck privilege niyo check niyo,
layunin ikabubuti bayan umatras iendorso,
floyd mayweather gets nearly knocked,
di kakasa sasabihin handler bbm tumaas survey,
siguro boxing matatalo bbm debate doubt manny pacquiao need jesus okay,
mukhang di niyo ata sinama balita niyo sina campaign activities kanina nasa kanina kunsabagay mas mahalaga pala inyo event gozon,
fuckyaw utak,
potacca tapang ha hahahahahahahahahahahaahahhahaahahahha topic divorce puro diyos binabanggit tanga sadyang nasobrahan suntok utak,
greatest boxing kncokouts,
eightdivision world champion history boxing won twelve major world titles pac became oldest welterweight world champion history age philippines,
world champion mark magsayo takes wbc title idol manny pacquiao,
moment waiting finally bring belt best idol thank advices kuya will work harder next fight,
sagot,
maritesssss balita,
salute true gentleman vpl,
excise tax suspended presidential candidates answer comelec debate read,
life losses either win learn champion today help provide family home link bio,
just dont know much respect,
thank knowing purpose tesda,
tamang tao iatfpara alam swimming labanan swimmer boxer boxing labanan edi boxer whooo bars,
emmanuel means god us,
presidential candidate manny pacquiao says first year administration will focus gdp improving countrys economy,
lets say undecided convince vote candidate please respectful go,
sinu karapatdapat manalo pagkapresidente pilipinas thread can choose ignore tweet since page right say piece,
manny pacquiao long shot presidential election tipped comeback,
years cameleon ph working protect amp heal young girls survivors sexual abuse centers provide safe amp therapeutic environment girls visit,
airdrop opensea account guys idol utility,
said politicians business using position benefit,
last election nagpapalit gyud kog tshirt du bsag di botante karon di gyapon botante hehehe,
black farmers link youtube videos description black many ll video,
crees que gane la presidencia de,
right thing help,
wrong move vp now drilon asking candidates consider withdrawing pres race favor leni ironic,
live streaming cctv observation system day age avoid voter fraud,
naniniwala chance win presidency saiyo suportahan sure winner,
hold ern smile future value will go epic names like year building cant wait try,
dares oneonone debate bbm give guy mirror instead,
vaya par de dos,
presidential debate just happen best far sayang wala,
kawatan mag samax kulungan,
mark word lagot,
hirap tanong tsaka rebutal malamang di aattend di mapaghahalataang bobo,
respect,
challenge live enter game use exclusive offer unlock box pacman fast since something just around weekend,
ahora guard el timelapse este coso es de minutos es feo estoy practicando velocidad sugirieron pacquiao versus ippo,
hear bbm sdc naumbag knock punch katotohanang sinusuntok inyo accountability candidates shun debates,
pacquiao malinis tubig baka sapat mapawi uhaw,
en san diego pacquiao jr tuvo su primera pelea amateur en estados unidos metro sk website,
will easier peaceful election candidates followers focus campaigning based truth credentials candidate yun siraan lies,
weeks message bodily discipline growing godliness working toward fulfilling promise life life come amazing happen take steps day,
thing men equal measure time successful depends best manage time make every minute week count god bless efforts,
sure loved stop visit united states army institute religious leadership soldier report ordered long awaited training,
christian lend prophetic vision insight generation nations culture policy pastor rocky,
christians influence nation culture politics will bow christian leader lead way culture pastor rocky,
christian person believes jesus christ follows teachings pastor rocky,
therefore say christian disciple christ full time student practitioner school teachings jesus christ believers antioch called christians disciples christ pastor rocky,
christian acts amp found brought back antioch entire year met others church instructed large numbers antioch disciples first called christians,
esther contd mordecai transgress kings command spoke day day listen told haman order see whether mordecais words stand told jew,
esther contd kings servants kings gate bowed paid homage haman king commanded concerning mordecai bow pay homage kings servants kings gate said,
im christian esther things king ahasuerus promoted haman agagite son hammedatha advanced set throne officials,
promdipdp presidential bet sen visited vice presidential candidate today whos currently recovering knee surgery,
good god bless patriots worldwide salute anyone willing stand freedom,
honoured supported noble project look forward renovation community centre serve purpose providing common space people adientem,
binago buhay panginoon dumaan pinatatag hirap buhay protektahan matapang haharapin magnanakaw maliliitin magbibigay karangalan bansa presidente,
deceptions kenyas tribalism president tribe will benefit benefit just feeling sure join us sunday continue mirror book esther bible kenya,
chief chaplains visits army chief chaplains chap mg thomas solhjem visits students chaplain captains career course heart home army chaplaincy institute religious leadership march,
airborne join us serve another,
todays listening,
thanq salute anyone willing fight freedom god bless,
army chief chaplains chap mg thomas solhjem holds town hall chaplain corps worldwide heart home army chaplaincy army institute religious leadership fort jackson south carolina march,
yes hope enjoyed give credit lord savior upstairs god bless btw,
thanq sir thanq service god bless military god bless john,
changed will rock will rebuke,
remain committed development issues beloved kwesimintsim constituency shall continue support effort towards realising prosperous kwesimintsim,
together ghanafu lets rock,
honor recognized adjudged best deputy minister health faks investigative services,
now can see say favorite animal gods creation filled beauty enough joy promote smile will look,
simple road success give best every day also hardest thing discipline can train consistent successful productive week,
register amp please share libreng pabahay trabaho pang kabuhayan mag register,
pangangampanya natutunan lalong nagpatibay plano mamamayang pilipino,
followup question paninindigan pagdating proposal gawin day work week makatipid empleyado inooppose employer,
matiyak sapat trabaho matatag kabuhayan dekalidad standard kasanayan gagraduate papasok mundo,
tingin puntong pilipinas handa namang covid surge palalakasin pagtugon nakaupo puwesto,
pananaw nagtagumpay build build build program kayoy maluklok itutuloy niyo yes,
sektor uunahin mong palakasin bigyang prayoridad upang mapabilis pagahon ekonomiya,
emmanuel manny pacquiao president,
really just good something take advantage opportunities comes way also dont lazy boxer became successful wealthy good,
laughable one sitting least never slapped degrees,
igorot boxing prodigy ifugao next manny pacquiao experts fans say,
hello,
remember always love family friends lets spread love peace unity hatred anger negative energy,
twitter keeps entertaining us fun creative presidentiable stuff particular account revealed four guess know reason one included ctto,
senator manny pacquiao tanong doctorney jose montemayor daw address sampung bata kaming ipapadala today alagaan magtatayo receiving center tuloytuloy supply bata,
ambisyoso utakdiba paps,
opinion manny hmmmm yes magalin boxer nasa senate manalo bang patunayan mapagkakaisa tao,
election season,
aerial shots crowd campaign rally manny pacquiao isabela read,
peoples champ support fight face corruption god bless,
manny able set aside personal ambition god country will enter league legendary filipino heroes filipino nation place history will hallowed sealed al,
manny able set aside personal ambition god country will enter league legendary filipino heroes filipino nation place history will hallowed sealed time,
make difference every time shop will donate portion purchase manny pacquiao foundation easy activate,
miss pagsabihan,
hey peeps know president niyo,
calling stop fight support thus will noble act country,
ayy gago wag kna lng magaksaya pagud pera vote kna lng bai,
manny gained respect staying true values,
manny pacquiao praised glorifying inspirational former opponent,
mabuting tao maka dios maka tao maka bansa wala hahanapin presidente,
yes louder pls need require else deserves win,
pity see downward spiral,
effects punched head decades now clearly manifesting,
botante puro fake news spliced videos sinishare share achievements plataporma kandidato malay mahikayat undecided,
manny pacquiao course lose philippines presidential election bid,
presidential bet evening answers light questions video watches netflix bonds kids etc fielded hard questions airing soon,
floyd mayweather tops manny pacquiao mike tyson pay per view,
pdp endorse time support,
lenlen level,
paquiao pushes pk minimum wage frontliners read,
smni debate will atnded professionals real panelist different sectors opportunity showcase brains platforms dont tell will attend thought real leader will show difficult times,
going attend smni debate coming march thought want bbm show will attend debate dont tell part mediocre really smart,
presidente mahal parin kita pilipino parin tayong,
natatawa bagong script supporters kulanghinihintay makulong sampahan kaso hahahaha,
mejo hilas part mag two joints sabay panic organic sabay pina kurog lips,
mayweathers kids taking naps,
pwede kayang sumakay di,
joseph reynoso presents manny pacquiao limits identity empire,
hahaha,
dire ta ky walay dudang buotan hantod karon wa ghapon mi tv siguradong matagaan ngyd mi,
va pacquiaoemmanuel,
sira ulo samali muna smni debate mag putak,
nakakalungkot pangyayari pilipinas kawatan nagkaisa personal interes grupo oposisyon watakwatak personal interes lord pls,
hinahamon di wow bka leni isko hamunin tutal mas malapit ratings char,
totoo sigurado akong mas malinis motibo plano senpaquiao kesa babym,
well said hope everyone find time read long post,
im going rekindle fervor look around us qarmy anons,
hakot kulay pilipino panalo naniniwala tayong pagasa pilipinas umasenso,
graduate school stops one even hours away home hotel assigned army course blessed quiet saturday study work weekend laundry,
visitors bring us joy thank pastor rocky gracing us presence last sunday guest sunday wrap marchs sermon series kwaheri road kiambu road,
hearing dr alveda king speak last night reminded one thing one thing gods children must kind,
atm sen attending fiscal management class peoples champion currently taking masters public administration philippine christian university,
kudos ghana black stars solid performance full heart skill even though win good position finish tie second leg come,
medal honor day,
eei sister hannah,
love game,
hold hope nation hands nation holds hearts solidly behind believe will make us proud go ghana,
maraming salamat isabela tuloy kinabukasan bayan president vice president partylist barbo senator,
salute flag just keep marching soldier lord psalm,
pro deo et patria god country,
promises nothing get ghanas planned hear today shall also look covid changes needed join us,
donated items received ekma municipal director education mrs catherine biney ekma premises believe items will effectively managed improve education delivery kwesimintsim constituency,
will support brothers make history together dont miss friday pm,
st,
dear god pray lasting friendships win win big together,
god bless grandchildren god wins end,
look forward lecture proud patriotic contributions towards development motherland,
theres nothing better reconnecting training chaplains walked together throughout career wonderful brothers chbolc,
anywhere counterfeit real one pastor enoch ceyc ronaldo blackstars leadership impact,
time join us lets discourse matters also catch lets,
